{
  "model_version": "0.1.0",
  "model_family": "inc15c6h-historical-1997-oig-ocig",
  "cited_official_historical_source": "FR Doc 97-14611, 62 FR 30859-30865",
  "original_archive_source": "1997-06-05 full issue official GPO PDF, not an individual FR document original",
  "referenced_report_section": "AF.10 and AFG.00/AFG.10",
  "official_full_issue_source_receipt": "evidence/hhs-counsel-source-editions/receipts/source-custody.json",
  "original_1997_full_issue_sha256": "75d648c24c18802812128e2708fe29340458b274d522d8e97ef38129bac1fe0d",
  "original_Federal_Register_published": "1997-06-05",
  "independently_declared_effective_date": null,
  "HHS_OIG_root_identity_ref": "INC15C3-HHS-LINK-OIG",
  "original_1997_Office_of_Counsel_code": "AFG",
  "historical_OIG_top_level_component_labels": 7,
  "historical_OCIG_internal_source_labels": 4,
  "source_historical_unit_observations_total": 11,
  "old_OGC_IG_and_litigation_coordination_consolidation_source_claim": true,
  "historical_OCIG_part_of_OGC_ongoing_supervision_claim": false,
  "current_OCIG_statutory_independent_legal_review_completed": false,
  "current_2026_OIG_roster_equivalence_independently_certified": false,
  "all_historical_division_labels_nonadditive": true,
  "HHS_current_legal_first_level_roster_total": null,
  "new_canonical_federal_agency_identifiers": 0,
  "items": [
    {
      "id": "INC15C6H-OIG1997-AFA",
      "publisher_label": "Immediate Office of the Inspector General",
      "publisher_source_code": "AFA",
      "source_publisher_era_type": "1997 OIG division",
      "parent_edition_identity": "INC15C3-HHS-LINK-OIG",
      "source_section_locator": "AF.10",
      "FR_printed_page_locator": "30860",
      "publication": "1997-06-05",
      "separately_specified_effective_date": null,
      "exact_original_publisher_source_key": "oig_fr_1997_issue",
      "original_source_sha256": "75d648c24c18802812128e2708fe29340458b274d522d8e97ef38129bac1fe0d",
      "source_edition_status": "historical_1997_org_statement_not_current_certification",
      "previous_OGC_IG_legal_relationship": "publisher_describes_OIG_OCIG_historical_consolidation",
      "cross_2026_office_identity_legally_equivalent_certified": false,
      "canonical_legal_new_HHS_institution_id": null,
      "current_subunit_roster_qualified": false,
      "OGC_commands_OIG_counsel": false,
      "current_statutory_authority_inferred_from_1997_notice": false,
      "ordinal": 1
    },
    {
      "id": "INC15C6H-OIG1997-AFC",
      "publisher_label": "Office of Management and Policy",
      "publisher_source_code": "AFC",
      "source_publisher_era_type": "1997 OIG division",
      "parent_edition_identity": "INC15C3-HHS-LINK-OIG",
      "source_section_locator": "AF.10",
      "FR_printed_page_locator": "30860",
      "publication": "1997-06-05",
      "separately_specified_effective_date": null,
      "exact_original_publisher_source_key": "oig_fr_1997_issue",
      "original_source_sha256": "75d648c24c18802812128e2708fe29340458b274d522d8e97ef38129bac1fe0d",
      "source_edition_status": "historical_1997_org_statement_not_current_certification",
      "previous_OGC_IG_legal_relationship": "publisher_describes_OIG_OCIG_historical_consolidation",
      "cross_2026_office_identity_legally_equivalent_certified": false,
      "canonical_legal_new_HHS_institution_id": null,
      "current_subunit_roster_qualified": false,
      "OGC_commands_OIG_counsel": false,
      "current_statutory_authority_inferred_from_1997_notice": false,
      "ordinal": 2
    },
    {
      "id": "INC15C6H-OIG1997-AFE",
      "publisher_label": "Office of Evaluation and Inspections",
      "publisher_source_code": "AFE",
      "source_publisher_era_type": "1997 OIG division",
      "parent_edition_identity": "INC15C3-HHS-LINK-OIG",
      "source_section_locator": "AF.10",
      "FR_printed_page_locator": "30860",
      "publication": "1997-06-05",
      "separately_specified_effective_date": null,
      "exact_original_publisher_source_key": "oig_fr_1997_issue",
      "original_source_sha256": "75d648c24c18802812128e2708fe29340458b274d522d8e97ef38129bac1fe0d",
      "source_edition_status": "historical_1997_org_statement_not_current_certification",
      "previous_OGC_IG_legal_relationship": "publisher_describes_OIG_OCIG_historical_consolidation",
      "cross_2026_office_identity_legally_equivalent_certified": false,
      "canonical_legal_new_HHS_institution_id": null,
      "current_subunit_roster_qualified": false,
      "OGC_commands_OIG_counsel": false,
      "current_statutory_authority_inferred_from_1997_notice": false,
      "ordinal": 3
    },
    {
      "id": "INC15C6H-OIG1997-AFF",
      "publisher_label": "Office of Enforcement and Compliance",
      "publisher_source_code": "AFF",
      "source_publisher_era_type": "1997 OIG division",
      "parent_edition_identity": "INC15C3-HHS-LINK-OIG",
      "source_section_locator": "AF.10",
      "FR_printed_page_locator": "30860",
      "publication": "1997-06-05",
      "separately_specified_effective_date": null,
      "exact_original_publisher_source_key": "oig_fr_1997_issue",
      "original_source_sha256": "75d648c24c18802812128e2708fe29340458b274d522d8e97ef38129bac1fe0d",
      "source_edition_status": "historical_1997_org_statement_not_current_certification",
      "previous_OGC_IG_legal_relationship": "publisher_describes_OIG_OCIG_historical_consolidation",
      "cross_2026_office_identity_legally_equivalent_certified": false,
      "canonical_legal_new_HHS_institution_id": null,
      "current_subunit_roster_qualified": false,
      "OGC_commands_OIG_counsel": false,
      "current_statutory_authority_inferred_from_1997_notice": false,
      "ordinal": 4
    },
    {
      "id": "INC15C6H-OIG1997-AFG",
      "publisher_label": "Office of Counsel to the Inspector General",
      "publisher_source_code": "AFG",
      "source_publisher_era_type": "1997 OIG division",
      "parent_edition_identity": "INC15C3-HHS-LINK-OIG",
      "source_section_locator": "AF.10; AFG.00; AFG.10",
      "FR_printed_page_locator": "30860-30863",
      "publication": "1997-06-05",
      "separately_specified_effective_date": null,
      "exact_original_publisher_source_key": "oig_fr_1997_issue",
      "original_source_sha256": "75d648c24c18802812128e2708fe29340458b274d522d8e97ef38129bac1fe0d",
      "source_edition_status": "historical_1997_org_statement_not_current_certification",
      "previous_OGC_IG_legal_relationship": "publisher_describes_OIG_OCIG_historical_consolidation",
      "cross_2026_office_identity_legally_equivalent_certified": false,
      "canonical_legal_new_HHS_institution_id": null,
      "current_subunit_roster_qualified": false,
      "OGC_commands_OIG_counsel": false,
      "current_statutory_authority_inferred_from_1997_notice": false,
      "ordinal": 5
    },
    {
      "id": "INC15C6H-OIG1997-AFH",
      "publisher_label": "Office of Audit Services",
      "publisher_source_code": "AFH",
      "source_publisher_era_type": "1997 OIG division",
      "parent_edition_identity": "INC15C3-HHS-LINK-OIG",
      "source_section_locator": "AF.10",
      "FR_printed_page_locator": "30860",
      "publication": "1997-06-05",
      "separately_specified_effective_date": null,
      "exact_original_publisher_source_key": "oig_fr_1997_issue",
      "original_source_sha256": "75d648c24c18802812128e2708fe29340458b274d522d8e97ef38129bac1fe0d",
      "source_edition_status": "historical_1997_org_statement_not_current_certification",
      "previous_OGC_IG_legal_relationship": "publisher_describes_OIG_OCIG_historical_consolidation",
      "cross_2026_office_identity_legally_equivalent_certified": false,
      "canonical_legal_new_HHS_institution_id": null,
      "current_subunit_roster_qualified": false,
      "OGC_commands_OIG_counsel": false,
      "current_statutory_authority_inferred_from_1997_notice": false,
      "ordinal": 6
    },
    {
      "id": "INC15C6H-OIG1997-AFJ",
      "publisher_label": "Office of Investigations",
      "publisher_source_code": "AFJ",
      "source_publisher_era_type": "1997 OIG division",
      "parent_edition_identity": "INC15C3-HHS-LINK-OIG",
      "source_section_locator": "AF.10",
      "FR_printed_page_locator": "30860",
      "publication": "1997-06-05",
      "separately_specified_effective_date": null,
      "exact_original_publisher_source_key": "oig_fr_1997_issue",
      "original_source_sha256": "75d648c24c18802812128e2708fe29340458b274d522d8e97ef38129bac1fe0d",
      "source_edition_status": "historical_1997_org_statement_not_current_certification",
      "previous_OGC_IG_legal_relationship": "publisher_describes_OIG_OCIG_historical_consolidation",
      "cross_2026_office_identity_legally_equivalent_certified": false,
      "canonical_legal_new_HHS_institution_id": null,
      "current_subunit_roster_qualified": false,
      "OGC_commands_OIG_counsel": false,
      "current_statutory_authority_inferred_from_1997_notice": false,
      "ordinal": 7
    },
    {
      "id": "INC15C6H-OIG1997-AFG-ADVICE",
      "publisher_label": "Advice",
      "publisher_source_code": "AFG-ADVICE",
      "source_publisher_era_type": "1997 counsel component",
      "parent_edition_identity": "INC15C6H-OIG1997-AFG",
      "source_section_locator": "AFG.10",
      "FR_printed_page_locator": "30863",
      "publication": "1997-06-05",
      "separately_specified_effective_date": null,
      "exact_original_publisher_source_key": "oig_fr_1997_issue",
      "original_source_sha256": "75d648c24c18802812128e2708fe29340458b274d522d8e97ef38129bac1fe0d",
      "source_edition_status": "historical_1997_org_statement_not_current_certification",
      "previous_OGC_IG_legal_relationship": "publisher_describes_OIG_OCIG_historical_consolidation",
      "cross_2026_office_identity_legally_equivalent_certified": false,
      "canonical_legal_new_HHS_institution_id": null,
      "current_subunit_roster_qualified": false,